{
  "$schema": "https://json-schema.org/draft/2020-12/schema",
  "$id": "urn:srcos:agent-machine:schema:steering-sourceset:v0.1.0",
  "title": "SteeringSourceset",
  "description": "Registry record for local SAE steering model/SAE artifact sourcesets. This contract records references only; it does not fetch artifacts or admit runtime activation.",
  "type": "object",
  "additionalProperties": false,
  "required": [
    "specVersion",
    "id",
    "kind",
    "sourcesetId",
    "status",
    "model",
    "sae",
    "endpointCompatibility",
    "activation",
    "policy"
  ],
  "properties": {
    "specVersion": {
      "type": "string",
      "const": "0.1.0"
    },
    "id": {
      "type": "string",
      "pattern": "^urn:srcos:agent-machine:steering-sourceset:[a-z0-9][a-z0-9.-]*$"
    },
    "kind": {
      "type": "string",
      "const": "SteeringSourceset"
    },
    "sourcesetId": {
      "type": "string",
      "pattern": "^[a-z0-9][a-z0-9.-]*$"
    },
    "status": {
      "type": "string",
      "enum": [
        "registered-not-loadable",
        "registered-blocked-terms",
        "ready-for-activation-work",
        "available",
        "blocked"
      ]
    },
    "readinessSummary": {
      "type": "string"
    },
    "model": {
      "type": "object",
      "additionalProperties": false,
      "required": ["family", "source", "license", "access"],
      "properties": {
        "family": { "type": "string" },
        "source": { "$ref": "#/$defs/sourceRef" },
        "license": { "type": "string" },
        "access": { "$ref": "#/$defs/accessRef" },
        "expectedFormat": { "type": "string" },
        "digestRequired": { "type": "boolean" },
        "expectedDigests": { "$ref": "#/$defs/expectedDigests" }
      }
    },
    "sae": {
      "type": "object",
      "additionalProperties": false,
      "required": ["source", "library", "hook", "featureIndexStatus", "access"],
      "properties": {
        "source": { "$ref": "#/$defs/sourceRef" },
        "library": { "type": "string" },
        "release": { "type": "string" },
        "saeId": { "type": "string" },
        "artifactPath": { "type": "string" },
        "hook": {
          "type": "object",
          "additionalProperties": false,
          "required": ["neuronpediaLayer", "modelLayer", "site"],
          "properties": {
            "neuronpediaLayer": { "type": "string" },
            "modelLayer": { "type": "integer", "minimum": 0 },
            "site": { "type": "string" }
          }
        },
        "featureIndexStatus": {
          "type": "string",
          "enum": ["known-demo-index", "not-selected", "pending"]
        },
        "demoFeatureIndex": {
          "type": "integer",
          "minimum": 0
        },
        "access": { "$ref": "#/$defs/accessRef" },
        "digestRequired": { "type": "boolean" },
        "expectedDigests": { "$ref": "#/$defs/expectedDigests" }
      }
    },
    "endpointCompatibility": {
      "type": "object",
      "additionalProperties": false,
      "required": ["endpoint", "requestShape", "responseShape"],
      "properties": {
        "endpoint": { "type": "string", "const": "/steer" },
        "requestShape": {
          "type": "array",
          "items": { "type": "string" },
          "minItems": 1
        },
        "responseShape": {
          "type": "array",
          "items": { "type": "string" },
          "minItems": 1
        }
      }
    },
    "activation": {
      "type": "object",
      "additionalProperties": false,
      "required": ["controlledActivationIssue", "loadableToday", "downloadsPerformed", "activationImplemented"],
      "properties": {
        "controlledActivationIssue": { "type": "string" },
        "loadableToday": { "type": "boolean" },
        "downloadsPerformed": { "type": "boolean", "const": false },
        "activationImplemented": { "type": "boolean", "const": false },
        "missing": {
          "type": "array",
          "items": { "type": "string" }
        }
      }
    },
    "policy": {
      "type": "object",
      "additionalProperties": false,
      "required": ["allowSecretInConfig", "requiresGrant", "requiresPolicyAdmission", "requiresStorageReceipt", "requiresEvidence"],
      "properties": {
        "allowSecretInConfig": { "type": "boolean", "const": false },
        "requiresGrant": { "type": "boolean" },
        "requiresPolicyAdmission": { "type": "boolean" },
        "requiresStorageReceipt": { "type": "boolean" },
        "requiresEvidence": { "type": "boolean" }
      }
    },
    "notes": {
      "type": "array",
      "items": { "type": "string" }
    }
  },
  "$defs": {
    "expectedDigests": {
      "type": "object",
      "additionalProperties": false,
      "description": "Digests a resolver MUST compare downloaded bytes against before recording them as verified. A file path present here is pinned; a file path absent is not pinned and may only be recorded as trust-on-first-use. This block is what makes digestRequired satisfiable — without it, digestRequired:true can never be honoured and resolution must fail closed.",
      "required": ["algorithm", "files"],
      "properties": {
        "algorithm": { "type": "string", "const": "sha256" },
        "files": {
          "type": "object",
          "minProperties": 1,
          "description": "Map of repo-relative file path to expected lowercase-hex sha256.",
          "additionalProperties": { "type": "string", "pattern": "^[a-f0-9]{64}$" }
        }
      }
    },
    "sourceRef": {
      "type": "object",
      "additionalProperties": false,
      "required": ["type", "repo", "url", "revision"],
      "properties": {
        "type": { "type": "string", "enum": ["huggingface", "github", "other"] },
        "repo": { "type": "string" },
        "url": { "type": "string" },
        "revision": { "type": "string" }
      }
    },
    "accessRef": {
      "type": "object",
      "additionalProperties": false,
      "required": ["posture", "gated", "operatorActionRequired"],
      "properties": {
        "posture": {
          "type": "string",
          "enum": ["public", "terms-required", "unverified"]
        },
        "gated": { "type": "boolean" },
        "operatorActionRequired": { "type": "string" }
      }
    }
  }
}
